{
  "schema_version": "skillguard.test_mesh_manifest.current",
  "mesh_id": "skillguard-owner-receipt-mesh",
  "source_model_id": "skillguard.validation_composition.current",
  "profiles": [
    {
      "profile_id": "fast",
      "closure_profile_id": "enforced",
      "requested_claims": ["source_release"],
      "owner_ids": [
        "owner:self:run-native-static-checks"
      ]
    },
    {
      "profile_id": "focused",
      "closure_profile_id": "enforced",
      "requested_claims": ["source_release"],
      "owner_ids": [
        "owner:self:run-declared-checks",
        "owner:self:run-native-static-checks",
        "owner:self:validate-step-evidence",
        "owner:self:validation-composition-model"
      ]
    },
    {
      "profile_id": "full",
      "closure_profile_id": "enforced",
      "requested_claims": [
        "global_router_current",
        "installed_current",
        "source_release"
      ]
    }
  ],
  "claim_boundary": "This current manifest selects compiler-owned execution owners through existing closure profiles. TestMesh plans exact reuse/missing owners, its public frozen-plan runner resolves only will_execute owners through their declared single-flight authority, and it aggregates immutable owner receipts; the manifest declares no commands, source paths, compatibility suites, or hidden execution fallback."
}
